{
  "rcfg_version": "1.0",
  "region": "FR-MA",
  "codePack": "BAEL-FR",
  "seismic": { "code": "RPS-2011", "zone": 2, "ductility": "ND2" },
  "units": { "length": "mm", "area": "cm2" },
  "element": {
    "type": "E-COL-01",
    "geometry": { "b": 300, "h": 600, "H": 3000 },
    "material": { "f_c28": 25, "f_e": 500, "exposure": "XC1", "d_g": 20 },
    "cover_mm": 30,
    "As_req": { "As_total": 12.0, "Asw_confinement": 4.5 }
  },
  "reinforcement": {
    "schemeId": "COL_TIES_CROSSTIE",
    "mode": "guided",
    "baseGroups": [
      {
        "id": "g-long",
        "kind": "REBAR_GROUP",
        "role": "PRIMARY_LONGITUDINAL",
        "zone": "As_total",
        "shapeArchetypeId": "DROITE",
        "params": { "L": 3000 },
        "diameter": 16,
        "distribution": { "mode": "FIXED_COUNT", "count": 8 },
        "placement": {
          "rule": "SECTION_PERIMETER",
          "layout": { "principle": "SYMMETRIC", "nTop": 3, "nBottom": 3, "nLeft": 2, "nRight": 2, "layers": 1 }
        }
      },
      {
        "id": "g-ties",
        "kind": "REBAR_GROUP",
        "role": "TRANSVERSE",
        "zone": "Asw_confinement",
        "shapeArchetypeId": "CADRE_RECT",
        "params": { "w": 240, "h": 540 },
        "diameter": 8,
        "distribution": {
          "mode": "SPACING_ALONG_PATH",
          "path": "placement.path",
          "segments": [
            { "region": "END_BOTTOM", "extent": "l_c", "spacing": 100 },
            { "region": "MIDDLE", "extent": "remainder", "spacing": 200 },
            { "region": "END_TOP", "extent": "l_c", "spacing": 100 }
          ]
        },
        "placement": { "rule": "ALONG_PATH", "path": { "ref": "COLUMN_HEIGHT" } }
      }
    ],
    "supplementalGroups": [
      {
        "id": "s-epingle-1",
        "kind": "REBAR_GROUP",
        "role": "SUPPLEMENTAL",
        "supplementId": "SUPP_EPINGLE_CROSSTIE",
        "shapeArchetypeId": "EPINGLE",
        "params": { "span": 240 },
        "diameter": 8,
        "distribution": { "mode": "SPACING_ALONG_PATH", "path": "= tie.spacing" },
        "placement": {
          "rule": "LINK_BAR_PAIR",
          "boundTo": { "group": "g-long", "barIndices": [1, 4] }
        }
      }
    ]
  },
  "meta": { "project": "Demo", "engineer": "—", "created": "2026-06-24", "appBuild": "M0" }
}
